,날짜,기사제목,기사내용
0,2021.12.17. 오전 8:17,연말연시 식료품·공산품 가격 인상 도미노…공공요금도 '들썩',"오미크론 변이·AI 확산에 '우크라 사태'까지 겹겹이 악재원자잿값 급등…내주 도시가스·전기요금 정부 발표 주목연말연시를 앞두고 주요 식료품과 공산품 가격이 크게 들썩이고 있다. 정부는 이달 13일부터 정부가 배추와 무, 사과, 소·돼지고기, 닭고기, 계란, 쌀 등 17개 품목을 설 성수품 물가안정 중점 관리품목으로 지정하고 집중적으로 관리하는 물가 대응시스템을 가동했다. 서울의 한 대형마트 계란 판매대. 연합뉴스연말연시를 앞두고 주요 식료품과 공산품 가격이 줄줄이 오르고 있다.오미크론 변이 확산에 따른 공급망 차질 심화에다 조류 인플루엔자(AI) 확산, 원자재 가격 상승, 우크라이나 정정 불안, 베이징(北京) 동계올림픽을 앞둔 중국의 '올림픽 블루' 정책 등이 겹친데 따른 것이다.30개들이 달걀 한 판 가격이 다시 6000원을 넘어섰고, 서민들 주요 먹거리인 치킨과 햄버거 가격도 올랐다. 자동차와 보일러 같은 공산품도 가격 인상 대열에 합류했다.다음 주 정부 발표를 앞둔 도시가스와 전기 요금도 국제 원자재 가격 폭등으로 강한 인상 압력을 받고 있어 어떤 결론이 도출될지 주목된다.■달걀·치킨·햄버거·콜라·죽…가격 인상 도미노17일 한국농수산식품유통공사 농산물 유통정보(KAMIS)에 따르면 지난 16일 기준 달걀 한 판(30개·특란) 평균 소매가격은 6401원을 기록했다. 1년 전보다 14.6% 오른 것이다.5000원대를 간신히 유지하던 달걀 가격은 이달 9일 6093원을 기록하면서 다시 6000원대에 진입했다. 이후에도 상승세가 꺾이지 않고 있다. AI가 확산하고 있기 때문이다.지난 11일 충남도와 세종시는 가금 농장을 대상으로 일시이동중지 명령을 내렸다. 이들 지역 농장을 중심으로 AI가 빠르게 번지면서다. 14일에는 전남 무안, 15일에는 충남 아산의 가금 농장에서 고병원성 AI가 추가로 확인됐다.AI 발생 농가는 한 달 만에 13곳으로 늘었다. 산란계(알 낳는 닭) 농장 피해가 커지면서 달걀 가격이 추가로 상승할 가능성이 커졌다.대표적인 서민 먹거리인 치킨과 햄버거 가격도 올랐다.국내 1위 치킨 프랜차이즈 교촌치킨이 지난달 가격을 올린 데 이어 bhc도 이달 20일부터 치킨 메뉴를 비롯한 일부 제품의 권장소비자가격을 1000∼2000원 인상할 예정이다. bhc의 치킨 가격 인상은 8년 만이다.대표 메뉴인 '해바라기 후라이드'는 1만 5000원에서 1만 7000원으로, '뿌링클 콤보' '골드킹 콤보' 등 콤보류와 '레드킹 윙' '맛초킹 윙' 등 윙류는 1만 8000원에서 2만 원으로 각각 값이 오른다.햄버거 프랜차이즈 롯데리아도 이달 1일부터 주요 제품 판매가격을 평균 4.1% 올렸다. 3900원이던 불고기버거 가격은 4100원이 됐다. 업계에서는 맥도날드와 버거킹도 조만간 인상 대열에 합류할 가능성이 큰 것으로 보고 있다.1∼2인 가구가 식사 대용으로 애용하는 편의점 죽 가격도 내년 1월부터 오른다.죽 시장 1위인 동원F＆B는 GS25와 CU 등 주요 편의점에 공급하는 양반죽 12개 상품의 가격을 내년 1월 1일부터 15%가량 인상한다고 최근 통지했다.이에 따라 양반야채큰죽, 양반전복큰죽, 양반쇠고기큰죽(404ｇ) 등의 소비자 판매가는 4500원에서 5200원으로 오를 전망이다. 동원F＆B가 편의점 죽 가격을 인상하는 것은 약 3년 만이다.코카콜라도 내년 1월 1일부터 '코카콜라 오리지날' 등 주요 제품의 가격을 평균 5.7% 인상하기로 했다.이에따라 편의점에서 판매하는 코카콜라 250mL 제품은 1500원에서 1600원으로, 500mL는 2100원에서 2200원으로, 1.5L는 3600원에서 3800원으로 각각 오른다.■공산품·공공요금도 불안…우크라 사태·中 올림픽 정책 등 겹쳐자동차 등 공산품과 공공요금 가격도 들썩이고 있다. 원유와 철강, 구리, 코발트, 니켈 등 주요 원자재 가격이 큰 폭으로 올랐기 때문이다.현대차는 최근 출시한 신형 싼타페(연식 변경) 가격을 1년 전 모델보다 5∼7% 정도 오른 3156만∼4321만 원으로 책정했다. 안전·편의 사양이 추가되면서 가격이 올랐다고 하지만 자동차를 구매하는 소비자의 부담은 커지게 됐다.한국GM이 수입해 판매하는 픽업트럭 쉐보레 콜로라도 가격도 5∼9%가량 올랐다. 이전 모델 가격은 3000만 원대 후반부터 시작했지만 올해 출시된 신형 모델 가격은 4050만 원부터 시작한다.차량용 반도체 수급난에 따른 생산 차질과 원자재 가격 상승으로 자동차 판매가가 오르는 '카플레이션'(car+inflation) 현상이 본격화하는 모습이다.포르쉐코리아는 최근 스포츠카 8세대 신형 911 GTS를 출시하면서 가격을 2380만 원이나 올렸고, 전기차 업체 테슬라도 모델 3와 모델 Y의 가격을 200만 원가량 인상했다.한국은행은 지난 16일 발표한 '물가안정목표 운영상황 점검' 보고서에서 글로벌 공급병목 현상 등의 영향으로 자동차 등 내구재 가격 오름폭이 올해보다 내년에 더 커질 것으로 내다봤다.좀처럼 오르지 않던 보일러 가격도 올랐다.경동나비엔은 이달 1일부터 가정용 가스보일러 가격을 평균 10% 인상했고, 15일부터는 귀뚜라미, 내년 1월부터는 린나이도 최대 6만 원 인상된 가격으로 보일러를 대리점에 공급한다. 보일러 가격 인상은 8년 만이다.그동안 가격 인상에 소극적이던 보일러 업계가 인상에 나선 것은 주요 자재인 구리, 스테인리스, 철 등 원자재 가격이 올해 들어 20∼30% 오른 데다 물류비 상승까지 더해졌기 때문으로 분석된다.도시가스와 전기 요금도 불안하다.산업통상자원부와 한국가스공사는 국제 유가 상승 등을 반영해 내년 초 가정용 도시가스 요금을 10% 안팎 인상하는 방안을 검토했지만, 기획재정부가 제동을 걸고 나선 상황이다.기재부는 가정용 도시가스 요금이 오르면 생활물가에 직결되는 만큼 인상에 부정적이지만 산자부는 원가를 반영한 요금 현실화가 절실하다는 입장이다.국제 액화천연가스(LNG) 현물 가격은 연초 저점 대비 7배 이상 올라 도시가스 요금 인상 압박 요인으로 작용하고 있다.정부는 도시가스와 전기요금 인상을 둘러싼 관계 부처 간 협의를 거쳐 이달 20일께 내용을 발표할 것으로 알려졌다.업계 전문가들은 이미 크게 오른 천연가스 가격이 우크라이나를 둘러싼 러시아와 서방 간 힘겨루기로 계속 불안한 상태이고, 중국이 베이징 동계올림픽을 앞두고 공장 가동을 중단시키면서 공급망 불안까지 심화하고 있어 인위적으로 물가 상승세를 억누르기가 쉽지 않을 것으로 보고 있다.홍콩 사우스차이나모닝포스트(SCMP)에 따르면 중국 당국은 최근 겨울철 스모그 발생을 줄여 베이징 동계올림픽 기간에 파란 하늘이 드러나는 이른바 '올림픽 블루'를 만들기 위해 베이징 등 64개 도시에서 공장 가동을 중단시켰다. 이 중에는 세계 최대 철강 생산 도시인 허베이(河北)성 탕산(唐山)과 중국 최대 탄광 지역인 산시(陝西)성, 주요 알루미늄 생산지인 허난(河南)성과 산둥(山東)성 등이 포함됐다고 SCMP는 전했다.'세계의 공장'인 중국이 주요 중공업 도시에서 공장 가동 중단을 확대하면서 안 그래도 불안한 공급망 차질 현상이 더욱 심화할 가능성이 있다고 SCMP는 분석했다."
1,2021.12.21. 오후 8:37,배추값 76% 껑충…도매가격 상승폭 13년 만에 최대,"[앵커]생산자물가지수, 도매가격이라고 보시면 되는데, 지난달에 13년 만에 가장 많이 올랐습니다. 이렇게 오른 가격은 조금 있으면 소비자물가에 반영됩니다. 채소나 고깃값이 많이 올라서 밥상물가가 걱정입니다.김서연 기자가 시장을 둘러봤습니다.[기자]오늘(21일) 오후 서울 마포구 농수산물시장.식당 자영업자들이 많이 찾는 도매시장이지만, 장을 보러 다니는 발걸음이 뜸합니다.[고경희/상인 : 지금 김장철이라 이 시간에 이 물건이 다 판매됐어야 되는데 지금 남아돌고 있습니다. 식당 주인들이 지금 장사가 덜 되니까 아예 구입하러 나오지 않으세요. 시장이 너무 한산하지 않습니까.]장을 보러 온 식당 주인들은 물가가 너무 올라 카트 채우기가 무섭다고 말합니다.[조용연/식당 주인 : 갈 때마다 깜짝깜짝 놀라는 거야. 1kg 한 봉투에 작년 같으면 1만8천원 이렇게 샀는데 지금 2만4천~5천원. 쇼핑 카트가 좌우지간 (기존의) 3분의 1밖에 안 올라와요.]한국은행에 따르면 도매가격이라 할 수 있는 생산자물가지수는 지난달 13년 1개월 만에 가장 큰 폭으로 뛰었습니다.올 겨울 때이른 추위로 작황이 부진했던 데다 김장철이 겹친 탓에 배추 76%, 오이 134% 등의 오름폭이 컸습니다.닭고기, 돼지고깃값도 20% 넘게 올랐습니다.생산자물가는 통상 한달 정도 시차를 두고 소비자물가에 반영되는 만큼, 연말과 내년 초 소비자물가 상승 압력이 커질 것이라는 우려가 나옵니다.[이은희/인하대 소비자학과 교수 : 소비자물가는 유통 단계의 마진 등이 또 추가되면 생산자물가 상승보다 조금 더 올라가는 경우도 많습니다. 올해도 문제가 심각했지만 내년 상반기에도 역시 서민 가계의 어려움이 더욱더 가중될 것으로 예상됩니다.]정부가 내년 1분기 전기요금을 동결하기로 했지만, 연일 뛰는 먹거리 가격을 잡지 않으면 물가 안정이 쉽지 않다는 게 전문가들의 지적입니다.(영상디자인 : 박상은)		"
2,2021.12.24. 오후 8:53,"""왜 치킨들은 작을까""…큰 닭고기 맛볼 수 없는 이유","			<앵커>최근 프랜차이즈 업체들이 치킨 가격을 잇따라 올렸습니다. 특히 가격은 올렸는데 닭고기 중량은 더 줄었다는 불만도 나옵니다. 정말 그런지, 왜 다 비슷한 크기의 닭고기만 유통되는지, 박하정 기자가 취재했습니다.<기자>치킨 한 마리, 다섯 군데에서 시켜봤습니다.튀김옷 그대로 무게를 재봤더니 모두 1kg를 넘지 않습니다.프랜차이즈 업체들이 쓰는 이 닭은 도계 후 중량이 951g~1,050g 정도 됩니다.왜 한결같이 작은 닭만 쓰고 큰 닭은 쓰지 않는 걸까?양계농장부터 찾아가봤습니다.이 업체, 10여 년 전부터 일반 닭보다 큰 2kg 넘는 닭 생산을 해왔던 곳입니다.[곽춘욱/양계업체 대표 : (왜 (큰 닭을) 안 키우는 거에요?) 안 키우는 게 아니라 못 키웠다는 얘기입니다. 과거 우리나라는 축사 환경, 시설이 굉장히 열악했습니다. 1.5kg 닭으로 우리나라 시장이 굳어져 버린 겁니다. ((요즘은) 이 정도 크기의 닭을 찾는 데가 많이 없어요?) 큰 닭을 찾는 데가 많지가 않아요.]왜 찾지 않는지, 이번엔 양계업체들의 닭을 납품받는 한 육계업체에 물어봤습니다.""프랜차이즈 업체가 요구하는 것에 맞춰서 생산하는 것뿐이다""라는 답이 돌아왔습니다.그래서 프랜차이즈 업체에도 물었습니다.""소비자가 가장 원하는 게 1.5kg 닭""이라고 했습니다.[프랜차이즈 업체 관계자 : 한 마리 기준으로 봤을 때는 10호 닭(작은 닭)이 가장 육질이 쫄깃하고 맛있어서…]또 모든 설비가 1.5kg 닭에 맞춰져 있다는 점도 이유로 들었습니다.결국 생산부터 유통, 소비까지 모든 시스템이 작은 닭에 맞춰져 있어 추가 비용을 들여 굳이 큰 닭을 시장에 들일 이유가 없는 셈입니다.양계농장은 육계업체를, 육계업체는 프랜차이즈를, 프랜차이즈는 소비자를 지목한 건데 정작 소비자들은 큰 닭 고를 기회조차 없었다는 볼멘소리가 나옵니다.2010년 큰 닭 보급을 시도했던 국립축산과학원에도 문의해봤습니다.마리 형태로 먹는 문화와 크기에 대한 소비자 인식 때문이라고 분석하면서 큰 닭이 없는 게 공급자 탓이냐, 소비자 탓이냐는 닭이 먼저냐, 달걀이 먼저냐 같은 문제라는 해석을 내놨습니다.다만, '더 큰 치킨을 만나려면' 큰 닭을 생산, 유통하는 통로를 따로 만들거나 큰 닭에 맞는 새 조리법을 개발하는 마케팅이 필요하다고 제안했습니다.(영상취재 : 이재영·최준식, 편집 : 김인선, 디자인 : 성재은·안지현)		"
3,2021.12.10. 오전 8:19,장바구니 물가 고공행진…축산물 가격 강세," Loading... player_likesound_mutesound_mutesound_volume2sound_volume3 [x]Player Size:0 x 0Current Resolution:0PMax Abr Resolution:0PProtocol:pdCurrent Bandwidth:Average Bandwidth:Buffer Health:Frame Drop Rate:0/0 도움말라이센스Video Statistic Version 4.26.10 (PD)Build Date (2021/10/1)NAVER Corp.     동영상 인코딩 중입니다.5분 이상 소요될 수 있으며, 영상의 길이에 따라 소요 시간은 달라집니다. topleft rightbottom마우스를 드래그 하세요360° Video도움말 MULTI TRACK멀티트랙의 트랙별 영상은 우측 관련영상에서 볼 수 있습니다.선거광고 안내       음소거00:00 | 00:00 화질 선택 옵션 화질  전체화면   광고정보 더보기초 후 SKIP초 후 재생SKIP광고 후 계속됩니다.SNS 공유소스 코드Band Twitter Facebook Blog CafeURL 주소복사HTML 소스544 x 306740 x 416936 x 5261280 x 720복사Flash 미지원으로 Object 코드 퍼가기 기능은 더 이상 지원되지않습니다.도움말 플레이어 URL 복사 레이어 닫기[KBS 대전][앵커]요즘 장바구니 물가의 고공행진이 계속되고 있습니다.특히, 달걀과 돼지고기 등 축산물의 가격 강세가 두드러지게 나타나면서 장바구니 물가 상승을 주도하고 있습니다.유진환 기자의 보도입니다.[리포트]각종 농산물을 판매하고 있는 대전 농협 농산물종합유통센터.코로나19 이후 수요가 크게 증가한 달걀 가격은 여전히 고공행진 중입니다.돼지고기와 닭고기 가격도 1년 전보다 10% 이상 상승해 주부들 마음이 무겁습니다.[정정한/대전시 문화동 : ""계란이 많이 올랐고요. 고기도 좀 올랐고 채소는 그래도 며칠 전보다는 조금 떨어진 느낌….""]지난달 대전의 소비자물가는 1년 전보다 3.7% 올라 두 달 연속 3%대 상승률을 기록했습니다.2012년 이후 9년여 만에 가장 높은 소비자물가 상승률입니다.품목별로는 농축수산물이 8%, 공업제품 5.9%, 서비스요금 1.9%, 전기수도가스가 0.8% 올라 농축수산물의 가격 상승이 가장 두드러졌습니다.김장철을 맞아 크게 올랐던 배추가격은 이달 들면서 점차 안정세를 찾고 있지만 축산물 가격의 강세는 계속되고 있습니다.농수산물유통공사의 조사에 따르면 이번 주 대전에서 판매되는 달걀은 1년 전보다 30%, 닭고기와 돼지고기 11%, 쇠고기는 2% 올랐습니다.특히, 달걀은 지난 겨울, 조류인플루엔자로 피해를 본 사육기반을 회복하면서 점차 가격 안정을 기대했지만, 지난달부터 다시 발생한 고병원성 조류인플루엔자가 다시 최대 변수로 등장했습니다.[배상진/농협대전농산물유통센터 축산담당 : ""앞으로 더 확산이 된다면 산란계 폐사라든지 공급 물량에 큰 영향을 줄 수 있기 때문에 앞으로 계란가격에 많은 영향을 미칠 것으로 생각하고 있습니다.""]농림수산식품부는 이달 중으로 달걀 3천만 개를 수입해 가격상승에 선제 대응하겠다는 방침을 밝혔습니다.KBS 뉴스 유진환입니다.촬영기자:서창석"
5,2021.12.02. 오후 2:51,‘금삼겹’ ‘다이아몬드급 한우’…요동치는 축산물 가격,"통계청, 지난달 축산물 가격 전년比 15%↑각 품목 골고루 다 올라…ASF, AI 우려도‘삼겹살 한 근에 1만5000원’ ‘한우 등심 300g에 4만1000원’축산물 가격이 요동치고 있다. 5개월 연속 10%대 상승률을 기록하며 고공행진 중이다. 상승폭이 점점 더 커지는 추세도 읽힌다. 공급 여력 부족보다는 수요 상승이 원인으로 분석된다. 때문에 공급량만큼은 유지해야 추가 가격 상승을 막을 수 있는데 위험 요소가 너무 많다. 충청도까지 퍼진 아프리카돼지열병(ASF)의 농장 감염 우려나 조류 인플루엔자(AI) 확산 우려가 상존한다. 물류 사정 악화로 대체재인 수입산 고기 공급이 막히는 경우의 수도 있다. 서민 물가 안정을 위해 최소한 국내 축산농장 방역만큼은 지켜내야 한다는 지적이 나온다.2일 통계청에 따르면 지난달 축산물 가격은 전년 동월 대비 15.0% 급증했다. 코로나19 발생 이후 가장 큰 폭으로 가격이 올랐다. 지난 6월(9.5%) 이후 점점 더 가격 상승폭이 커지고 있는 점도 눈에 띈다.특정 품목 문제가 아니라는 점이 특징이다. 지난 8월까지만 해도 AI 여파로 급등한 계란 가격이 축산물 가격 상승을 주도했다. 그런데 지금은 상황이 달라졌다. 지난달의 경우 돼지고기(14.0%), 닭고기(13.3%), 국산 쇠고기(9.2%) 등 축산물 전체가 골고루 상승세를 이끌었다. 가격이 큰 폭으로 안 오른 품목을 찾아보기가 힘들다.향후 더 오를 가능성이 있다는 게 문제다. 일단 공급 측면에서 우려되는 부분이 있다. 그 동안 경기·강원도에서만 확인돼 왔던 ASF에 감염된 야생 멧돼지가 충청권까지 내려왔다. 지난달 충북 제천시와 단양군에서 ASF 감염 개체가 발견됐다. 야생 멧돼지를 매개로 내려 온 ASF가 충청권에 위치한 돼지농장 감염으로 이어질 경우 돼지고기 가격이 급등할 수 있다. 충남도 소재 돼지농장에서 사육 중인 돼지는 246만3866마리로 전국 사육두수의 20.8%를 차지한다.닭고기나 계란 가격에 영향을 미칠 수 있는 AI도 기승이다. 올 겨울에도 8건의 농장 감염 사례가 나왔다. 지난달 23일 이후 농장 감염 사례가 소강상태인 점이 그나마 다행스러운 부분이지만 언제 확산세가 강해질지 알 수 없다.대체재인 수입산 고기마저 기대하기 쉽지 않은 상황이라 방역의 중요성이 더욱 커졌다는 평가가 나온다. 지난달 수입 쇠고기 가격은 물류 등 여건으로 인해 전년 대비 24.6%나 급등했다. 농식품부 관계자는 “발생 가능성을 차단하도록 방역에 힘을 쏟을 것”이라고 말했다.		"
6,2021.12.04. 오전 9:24,"""솔직히 이 가격은 선 넘었지""…2200원 '장인라면', 소비자 생각은","출시 한 달 만에 누적 판매량 300만봉 달성 성공재료 엄선하고 나트륨 함량 낮췄지만 가격이 변수지난 10월 14일 서울 강남구 논현동 하림타워에서 열린 'The미식 장인라면' 출시 미디어 데이에서 김홍국 하림그룹 회장이 직접 끓인 라면을 선보이고 있다. [사진 출처 = 하림, 연합뉴스] ""광고 보고 혹해서 샀죠. 맛있을 줄 알았는데 그 가격이면 과한 것 같아요.""35년 내공의 식품 전문기업 하림이 배우 이정재를 모델로 해 선보인 '장인라면'에 대한 반응이 엇갈리고 있다. 하림은 제품 출시 한 달여 만에 누적 판매량 300만봉을 돌파했다며 자부하고 있지만, 소비자들 사이에서는 기대에 부응하지 못했다는 반응이 나온다.하림은 지난 10월 14일 기자간담회를 열고 '더(The) 미식 장인라면'의 출시를 시장에 알렸다. 인스턴트 식품으로 저평가 받아온 가공식품을 장인이 만든 요리 수준으로 끌어올려 가정에서도 미식(美食)을 즐길 수 있도록 하겠다는 게 하림의 목표였다.이 때문에 재료 선정 단계부터 까다로웠다는 것이 하림의 설명이다. 사골과 소고기, 닭고기 등 신선한 육류 재료와 각종 양념 채소를 활용했고, 본연의 맛과 향을 위해 분말 스프 대신 액상 스프를 고집했다.등장도 화려했다. 김홍국 하림그룹 회장이 직접 라면바 메인 퍼포먼스에 나선 것. 김 회장은 지난 10월 14일 서울 강남 하림타워에서 열린 기자간담회에서 조리복을 입고 나온 뒤 직접 라면을 끓여 선보였다.그러나 소비자들의 반응은 미적지근했다.일반 라면보다 가격이 비싸다는 게 가장 큰 변수였다. 장인라면의 가격은 편의점 기준으로 봉지라면이 2200원, 컵라면이 2800원이다. 진라면과 신라면 등 일반 라면이 대체로 700원대인 점을 감안하면 사실상 3배에 달하는 가격이다.유튜브나 사회관계망서비스(SNS), 블로그와 각종 커뮤니티 등에 올라있는 소비자 후기 또한 대부분 부정적이다. 가격만큼 프리미엄급 품질을 기대했으나, 맛이 기대에 미치지 못한다는 것이다. 지난 10월 14일 서울 강남구 논현동 하림타워에서 열린 'The미식 장인라면' 출시 미디어 데이에서 김홍국 하림그룹 회장이 라면을 소개하고 있다. [사진 출처 = 하림, 연합뉴스] 소비자들 사이에서는 ""뒤끝에 쓴맛이 올라온다""거나 ""라면보다 고추장찌개 같은 맛"", ""이 맛에 이 가격이면 솔직히 선을 넘었다"", ""확실히 다르다. 가격만"", ""다시 사 먹을 일은 없을 것 같다"" 등 부정적인 평이 지배적이다. 지속해서 소비하기에는 가격대가 무리라는 것.물론 일부 소비자는 ""기름기도 덜한 건면이고, 건더기도 큼직하다""라거나 ""일반 라면보다 덜 짜고 건강한 맛""이라고 호평하기도 한다.하림에 따르면 장인라면의 면은 제트노즐 공법 건조로 바람에 말려 쫄깃하고 잘 불지 않는 건면이다. 또 실제로 나트륨 함량도 기존 라면(1650mg~1880mg)보다 적은 1430mg 수준이다.식품업계에서도 평은 갈린다.장인라면을 출시한 하림 측은 지난달 18일 ""장인라면이 출시 약 한 달만에 누적 판매량 300만봉을 돌파했다""며 ""시간당 판매량으로 환산하면 1초마다 한 봉지 이상 판매된 셈""이라고 밝혔다.하림은 이를 유의미한 성과라고 분석하고 있지만, 식품업계의 판단은 사뭇 다르다. 오뚜기가 선보였던 '참깨라면'의 경우 뚜렷한 마케팅 없이 입소문만으로도 출시 후 한 달 만에 300만봉가량을 판매하는 데 성공한 바 있어서다.또 업계에서 '대박' 사례로 꼽는 삼양식품의 '까르보불닭볶음면'은 출시 후 한 달만에 1100만봉 이상이 판매되는 기염을 토하기도 했다. 까르보불닭볶음면 역시 참깨라면처럼 입소문만으로 실적을 냈다.한 식품업계 관계자는 ""300만봉이면 사실 초기 판매량으로는 괜찮은 편""이라며 ""문제는 지속가능성이다. 상품 출시 초기에는 궁금해서 사보는 소비자가 많은데 그들을 어떻게 '충성 고객'으로 만들지가 하림의 성공 여부를 좌우할 것""이라고 내다봤다.하림은 앞으로도 장인라면 외에 집에서 편리하게 미식을 즐길 수 있는 가정간편식(HMR) 제품을 출시한다는 계획이다."
