,날짜,기사제목,기사내용
380,2021.11.08. 오후 4:04,"황교익, 치킨 논란 반박 ""우리 닭은 1.5㎏…외국은 3㎏ 내외""","""닭 커지지 않는 이상 맛없고 비싸""""부정할 거면 농촌진흥청부터 공격""맛 칼럼니스트 황교익 씨 / 사진=연합뉴스맛 칼럼니스트 황교익 씨가 한국 치킨 논란에 대해 ""우리 닭은 1.5㎏이지만 외국은 3㎏ 내외로 키워 잘도 튀겨서 먹고 있다""라며 닭이 커지지 않는 이상 맛없고 비싸다는 주장을 이어나갈 것임을 거듭 강조했습니다.오늘(8일) 황 씨는 자신의 페이스북에 ""나는 한번 툭 치고 마는 논쟁은 하지 않는다. 닭이 작아서 치킨의 맛이 비고 가격이 비싸다는 사실을 확인했으니 그 닭이 커지는 것을 보고 난 다음에야 논쟁을 멈출 것""이라며 이같이 밝혔습니다.황 씨는 ""치킨으로 요리되는 닭은 육계""라며 ""이 육계는 전 세계에서 품종이 동일한데 한국만 유일하게 1.5㎏ 소형으로 키운다. 외국은 3㎏ 내외로 키운다""라고 설명했습니다.그는 ""3㎏ 내외의 닭이 1.5㎏ 닭에 비해 맛있고 고기 무게당 싸다는 것은 한국 정부기관인 농촌진흥청이 확인해주고 있다""며 ""한국 외 전 세계의 나라에서 3㎏ 내외의 닭으로 치킨을 잘도 튀겨서 먹고 있다""라고 지적했습니다.이어 ""나를 음식문화판에서 쫓아내면 치킨 논쟁은 사라질 것이라고 판단한 세력이 있었다고 나는 추측한다""며 ""내 말을 부정할 것이면 먼저 농촌진흥청을 공격하라. 싸움을 하려면 적어도 당당하게 하라""라고 강하게 비판했습니다.1일 오후 서울 송파구 잠실구장에서 열린 프로야구 2021 신한은행 쏠(SOL) KBO 포스트시즌 와일드카드 결정전 키움 히어로즈와 두산 베어스의 경기에서 치맥을 먹으며 경기 시작을 기다리는 관중들 / 사진=연합뉴스황 씨는 지난 3일에도 ""한국 치킨은 닭고기 맛이 아니라 양념 맛으로 먹고 가격도 비싸다""며 ""우리가 화를 내야 할 대상은 그 작은 닭을 비싸게 파는 구조를 만들어 놓은 사람들이다. '한국 치킨이 맛없고 비싸다'고 수년째 반복해서 말하고 있다. 피곤한 일이지만 저는 맛 칼럼니스트이기에 이런 일을 하는 게 직업적 운명""이라고 일갈했습니다.한편, 황 씨는 몇 년 전부터 '잘 키운 닭, 제대로 키운 닭, 적절한 맛이 나는 닭으로 튀겨야 한다'며 치킨업계 닭 크기에 대해 쓴소리를 이어왔습니다. 그는 2019년 한 라디오에 출연해 ""(한국은) 닭이 맛이 없기 때문에 튀기는 솜씨와 양념 솜씨가 굉장히 발달했다""며 ""그런 조리법을 갖고 있으니 닭이 맛있으면 더 맛있게 먹을 수 있다""라고 주장하기도 했습니다."
381,2021.11.09. 오전 6:16,황교익 “한국 치킨 맛없고 비싸…닭 외국처럼 커져야”,"[연합][헤럴드경제=민성기 기자] 맛칼럼니스트 황교익씨가 국내산 닭이 커지지 않는 이상 한국 치킨은 맛없고 비싸다는 주장을 이어갔다.황씨는 8일 자신의 페이스북을 통해 “난 한 번 툭 치고 마는 논쟁은 하지 않고 끝장을 볼 것이다. 닭이 작아서 치킨의 맛이 비고 가격이 비싸다는 사실을 확인하고 나서 내가 이를 이슈로 삼겠다고 결정하면 그 닭이 커지는 것을 보고 난 다음에야 논쟁을 멈춘다”고 밝혔다.그는 “수년 전에 닭이 작아서 치킨이 맛없다고 언론에 인터뷰 했을 때 인터넷 온갖 곳에 ‘큰 닭을 튀겨봐라. 황교익을 요리를 모른다’, ‘한국인은 영계를 좋아하는 입맛을 갖고 있다. 외국인도 한국 치킨을 맛있다고 한다’는 글이 조금씩 변형돼 도배됐다”며 “내가 던진 메시지의 사실 관계를 확인하지 못하게 메신저 공격을 한 것”이라고 말했다.이어 “워낙 광범위하게 전개된 공격이라 나는 방어를 제대로 못 하고 당해야 했다”며 “메신저 공격으로 나를 음식문화판에서 쫓아내면 치킨 논쟁은 사라질 것이라고 판단한 세력이 있었다고 나는 추측한다”고 언급했다.그러면서 “착각들 하지 마라. 그 같은 공격에 내가 음식문화판에서 쫓겨날 정도면 천일염 논쟁 때 이미 내 목숨은 달아났을 것”이라며 “천일염은 정부, 학계, 생산자단체 연맹에 맞서 나 혼자서 8년을 싸웠고 내가 이겼다”고 주장했다.황씨는 “치킨으로 요리되는 닭은 육계이다. 이 육계는 전세계가 그 품종이 동일하다”며 “전세계에서 한국만 유일하게 1.5kg 소형으로 키운다. 외국은 3kg 내외로 키운다”고 설명했다.이어 “3kg 내외의 닭이 1.5kg 닭에 비해 맛있고 고기 무게당 싸다는 것은 한국 정부기관인 농촌진흥청이 확인해주고 있다”며 “한국 외 전세계의 나라에서 3kg 내외의 닭으로 치킨을 잘도 튀겨서 먹고 있다”고 강조했다.그러면서 “떼를 지어 거짓으로 나를 공격했던 익명의 그대들에게 요구한다. 얼굴과 이름을 공개하고 말하라”라며 “내 말을 부정할 것이면 먼저 농촌진흥청을 공격하라. 비겁한 것들, 싸움을 하려면 적어도 당당하게 하라”고 덧붙였다.앞서 황 씨는 지난 3일에도 ""한국 치킨은 닭고기 맛이 아니라 양념 맛으로 먹고 가격도 비싸다""며 ""우리가 화를 내야 할 대상은 그 작은 닭을 비싸게 파는 구조를 만들어 놓은 사람들""이라고 지적한 바 있다. 그는 '한국 치킨이 맛없고 비싸다'고 수년째 반복해서 말하고 있다""며 ""피곤한 일이지만 저는 맛 칼럼니스트이기에 이런 일을 하는 게 직업적 운명""이라고 말했다.한편, 황 씨는 몇 년 전부터 '잘 키운 닭, 제대로 키운 닭, 적절한 맛이 나는 닭으로 튀겨야 한다'며 치킨업계 닭 크기에 대해 쓴소리를 이어왔다.그는 2019년 한 라디오에 출연해 ""(한국은) 닭이 맛이 없기 때문에 튀기는 솜씨와 양념 솜씨가 굉장히 발달했다""며 ""그런 조리법을 갖고 있으니 닭이 맛있으면 더 맛있게 먹을 수 있다""라고 주장하기도 했다."
382,2021.11.12. 오전 7:33,얼굴빛 젊고 윤기있게 만들어 주는 식품 3가지,"빨간 피망 속 카로티노이드, 주름 예방 및 피부 혈액 순환에 도움ⓒ픽사베이딱히 아프거나 피곤하지 않음에도 친구들을 만나면 '어디 아프냐'는 걱정부터 듣게 되는 사람들이 있다. 이런 경우 대부분은 칙칙한 피부톤이나 푸석한 피부 표면 때문이다. 효과 면에서 보자면 피부과를 찾아가 전문가의 치료를 받는 것이 가장 확실하겠지만 가격이나 시간면에서 여유롭지 않아 번번이 포기하기 일쑤다. 이럴 땐 피부를 팽팽하게 유지하고 주름살을 방지하는데 좋은 식품들을 꾸준히 챙겨먹는 것이 도움이 될 수 있다. 얼굴빛을 생기있게 만들고 주름 예방에도 좋은 식품 3가지를 알아보자.▲ 기름기 없는 살코기한 연구 결과에 따르면 단백질의 섭취량이 적은 여성들의 경우 주름이 더 많았다. 특히 나이가 든 여성들이 단백질 섭취가 부족할 경우 피부가 쉽게 갈라지거나 찢어질 수 있어 주의해야 한다. 반대로 단백질이 풍부한 닭고기나 콩을 꾸준히 섭취하면 피부를 팽팽하게 하는데 도움을 받을 수 있다.▲ 빨간 피망아삭아삭한 특유의 식감 덕에 다이어터들의 건강한 간식으로 사랑받는 빨간 피망. 빨간 피망에는 하루 필요량 이상의 비타민 C는 물론 식이섬유, 비타민 B6까지 풍부하게 들어있다. 특히 주름살 예방 및 피부 혈액 순환에 좋은 카로티노이드를 다량 함유하고 있어 젊은 피부를 유지하는데 큰 도움을 준다.▲ 셀러리셀러리의 비타민 K는 혈액순환을 돕고 높은 혈압을 낮추는데 도움을 줄 수 있다. 아울러 스트레스 수치를 감소시킴으로써 편두통 예방이나 피부 개선에도 도움을 준다. 또한 셀러리에는 수분은 물론 천연 나트륨과 칼륨까지 들어있어 피부가 건조해지는 것을 방지하고 주름살을 예방하는데 도움이 될 수 있다."
383,2021.11.09. 오전 11:21,음성 메추리농장 AI 의심신고…전국 48시간 일시이동중지(종합),"가금농가 3월 30일 후 발생 없어…야생조류 1일 확진가금농장·축산시설·축산차량 이동제한…위반시 처벌조치[세종=이데일리 이명철 기자] 충북 음성 메추리농장에서 고병원성 조류인플루엔자(AI) 의심가축이 나타나면서 가금농가 우려가 확산될 조짐이다. 방역 당국은 전국 가금농장 등에 대해 48시간 동안 일시이동중지 명령을 내리고 AI 확산 차단에 나섰다.박병홍(왼쪽 첫번째) 농림축산식품부 차관보가 9일 정부세종청사에서 긴급방역상황회의를 주재하고 있다. (사진=농식품부)AI 중앙사고수습본부는 9일 음성에 위치한 메추리 농장에서 고병원성 AI 의심가축이 확인됨에 따라 전국 일시이동중지(Standstill) 명령을 발령한다고 밝혔다.해당 농장은 약 77만마리의 메추리를 사육 중이다. 중수본은 의심신고 접수 후 현재 정밀 검사를 진행 중이다. 고병원성 여부는 1~3일 후 나올 예정이다.중수본은 고병원성 AI 의심축이 확인된 즉시 초동대응팀을 현장에 투입해 해당 농장에 대한 출입 통제, 예방적 살처분, 역학조사 등 선제 방역조치를 실시 중이다.중수본에 따르면 이달 1일 충남 천안시 곡교천에서는 야생조류인에서 H5N1형 고병원성 AI가 확진돼 올해 3월 30일 강원 고성 송지호(H5N8형) 이후 7개월여만에 야생조류에서 고병원성 AI가 발생했다.가금농장은 지난 4월 6일 장흥 육용오리를 마지막으로 아직까지 발생이 없는 상태지만 야생조류의 고병원성 AI 확산에 따른 농가 유입 가능성은 높아지고 있다.농가에 AI가 확산할 경우 살처분 조치와 이동 통제 등으로 닭고기와 달걀(계란) 수급에 차질이 발생해 가격이 오를 수 있는 만큼 방역 조치가 관건이 되고 있다.이번 전국 일시이동중지 명령은 9일 오전 11시부터 오는 11일 오전 11시까지 48시간 동안 전국 가금농장과 사료공장·도축장 등 축산시설, 축산차량에 적용한다.지자체와 생산자단체 등 관련기관에 해당 명령을 전파하고 가금관련농장·축산시설·축산차량 운전자 대상 문자메시지를 전송해 알릴 예정이다. 농장에서 사료가 부족해 공급이 필요하거나 알 반출이 불가피한 경우 소독 등 방역조치 강화를 전제로 이동승인서를 발급해 이동을 허용할 방침이다.중수본은 이동중지 기간 중 중앙점검반을 구성해 농장·시설·차량의 명령 이행여부를 점검한다. 이동승인서와 소독조치 없이 일시이동중지 명령을 위반하면 가축전염병예방법 제57조에 따라 1년 이하의 징역 또는 1000만원 이하의 벌금 처분을 받게 된다.전국 가금농장, 소하천·소류지를 포함한 철새도래지, 축산시설·축산차량 일제 소독·방역점검도 실시한다. 의심축 발생 농장 주변 철새도래지와 도로·농장에는 광역방제기·군제독차량·방제헬기 등 가용 자원을 총동원한다.중수본은 이날 긴급방역상황회의를 열고 고병원성 AI 예방과 확산 방지를 위한 등 농장 4단계 소독을 강조했다.우선 농장 진입로에 바닥이 보이지 않을 만큼 1주일 간격으로 충분히 도포하고 농장 내부, 사료빈·퇴비사 주변 매일 청소·소독, 사료·폐사축·왕겨 등 야생 조수류 유인 요소 즉시 제거를 실시해야 한다.지정된 관리자 외 축사 출입을 최대한 통제하고 축사 출입 시에는 손 소독, 전용장화로 갈아신기를 해야 한다. 축사는 천장·벽·바닥순으로 청소·소독하고 가축과 직접 접촉 물품에 대한 철저한 소독과 외부 반출 금지를 해야한다.중수본 관계자는 “전국 가금농장·관련시설 점검과 발생농장 역학조사 중 가축전염병예방법 등 관계 법령에 위반사항이 있을 경우 엄중 처벌한다”며 “사육농가는 사육가금에서 폐사·산란율 저하 등 이상 여부 확인시 즉시 방역당국으로 신고해달라”고 당부했다.(이미지=농식품부)"
384,2021.11.10. 오후 12:13,올가을 첫 고병원성 AI 농장 확진…계란값 다시 비상,"  9일 충북 음성군 금왕읍의 한 메추리 농장에 고병원성 조류인플루엔자(AI) 바이러스 항원이 검출돼 출입을 통제한 모습. 음성군           올가을 들어 처음으로 가금농장에서 고병원성 조류인플루엔자(AI)가 발생했다.      고병원성 AI 중앙사고수습본부(중수본)는 10일 충북 음성의 한 메추리 농장에서 고병원성 AI(H5N1형)가 확진됐다고 밝혔다. 중수본은 앞서 9일 해당 농가에서 의심 신고를 받은 뒤 정밀검사를 실시했다.      중수본은 해당 농장에서 사육하던 메추리 77만 마리를 살처분하고 농장 출입 통제, 역학조사 등을 진행했다. 오는 11일 오전 11시까지 전국 가금농장, 축산시설(사료 공장, 도축장 등), 축산차량에 대해 일시이동중지(standstill) 명령이 발동 중이다.      발생 농장에서 3㎞ 안에 있는 충북 음성의 다른 육용 오리 농장에서도 9일 의심 신고가 접수돼 정밀검사를 벌이고 있다. 고병원성 확진 여부는 1~3일 안에 나올 예정이다.        김부겸 국무총리는 이날 오후 정부서울청사에서 고병원성 AI 관계부처 및 지방자치단체 회의를 개최하고 대응 방안을 논의할 예정이다. 김 총리는 우선 “긴급행동지침(SOP)에 따른 방역 조치를 신속히 실시해 고병원성 AI가 타 지역으로 확산하지 않도록 하라”고 지시했다.        야생조류에선 지난 1일 충남 천안 곡교천에서 약 7개월 만에 고병원성 AI가 발생했다. 이후 전북 부안 고부천, 전북 정읍 정읍천의 야생조류가 잇따라 확진 판정을 받았다.      고병원성 AI의 확산 조치로 가금산물 가격 폭등에 대한 우려도 커지고 있다. 살처분 조치와 이동 통제 등으로 닭고기와 달걀(계란) 수급에 차질이 발생하기 때문이다.        실제 지난 겨울 전국 109개 농가에서 고병원성 AI가 발생해 주변 농장 가금류 약 3000만마리가 살처분됐다. 이후 전국 계란 수급에 비상이 걸리면서 계란값이 무섭게 치솟았다. 지역과 계란 종류에 따라 한 판에 1만원을 넘는 이른바 ‘금계란’도 나왔다.      고병원성 AI 확산세가 지속되면 올해 초처럼 계란값 급등 현상이 반복될 가능성이 크다. 이는 최근 상승폭을 키우고 있는 물가에도 부담이 될 전망이다.      중수본 관계자는 “가금농가는 발생과 전파 방지를 위해 농장 등 관련 시설을 소독하고 방역 조치를 철저히 해달라”며 “사육 가금에서 폐사ㆍ산란율 저하 등 이상을 확인하면 즉시 방역 당국으로 신고해 줄 것”을 당부했다.  "
385,2021.11.09. 오전 9:04,다시 번지는 조류인플루엔자 공포…음성 농장서 의심신고,"메추리 사육농장 의심가축 확인, 초동방역조치야생조류 이달 1일 7개월만에 고병원성 AI 확진지난달 21일 경기도 용인시 처인구 백암면 청미천 일대에서 용인축산농협 방역차가 조류인플루엔자(AI) 예방을 위해 방역을 하고 있다. (사진=연합뉴스)[세종=이데일리 이명철 기자] 고병원성 조류인플루엔자(AI) 위험 시기인 겨울철이 다가오면서 농장에서 발생 가능성이 높아지고 있다.AI 중앙사고수습본부는 충북 음성 소재 메추리 농장에서 고병원성 AI 의심가축이 확인됐다고 9일 밝혔다.해당 농장은 약 77만마리의 메추리를 사육 중이다. 중수본은 의심신고 접수 후 현재 정밀 검사를 진행 중이다. 고병원성 여부는 1~3일 후 나올 예정이다.중수본에 따르면 이달 1일 충남 천안시 곡교천에서는 야생조류에서 H5N1형 고병원성 AI가 확진돼 올해 3월 30일 강원 고성 송지호(H5N8형) 이후 7개월여만에 야생조류에서 고병원성 AI가 발생했다.가금농장은 지난 4월 6일 장흥 육용오리를 마지막으로 아직까지 발생이 없는 상태지만 야생조류의 고병원성 AI 확산에 따른 농가 유입 가능성은 높아지고 있다.농가에 AI가 확산할 경우 살처분 조치와 이동 통제 등으로 닭고기와 달걀(계란) 수급에 차질이 발생해 가격이 오를 수 있는 만큼 방역 조치가 관건이 되고 있다.중수본은 고병원성 AI 의심축이 확인된 즉시 초동대응팀을 현장에 투입해 해당 농장에 대한 출입 통제, 예방적 살처분, 역학조사 등 선제 방역조치를 실시 중이다.중수본 관계자는 “축산농가와 축산관계자는 고병원성 AI 발생과 전파 방지를 위한 농장·관련시설 소독 등 방역조치를 철저히 해야 한다”며 “의심증상이 없는지 면밀히 관찰해 사육 가금에서 이상이 있는 경우 즉시 방역당국으로 신고해달라”고 당부했다."
