,날짜,기사제목,기사내용
170,2021.12.21. 오전 6:00,전기요금 동결에 시민들 “다른 것 다 올랐는데 생색내기” 힐난,"마트 판매 가공식품 ‘다 올랐다’…AI 영향 계란값 또 오름세동결한다고 부담 줄어드나…‘조삼모사’ 시민들 불신감 팽배정부가 내년 1분기(1~3월) 전기 요금을 전격 동결한 가운데 소비자들은 다소 안도하면서도 체감물가가 여전히 높다며 고통을 호소하고 있다.© News1(대전=뉴스1) 심영석 기자 = 정부가 내년 1분기(1~3월) 전기 요금을 전격 동결한 가운데 소비자들은 다소 안도하면서도 체감물가가 여전히 높다며 고통을 호소하고 있다.원재료 상승 등을 이유로 유통·식품업계가 줄줄이 가격 인상에 나선 데다 최근에는 전국 각지에서 고병원성 조류인플렌자(AI)가 발생하면서 계란값이 다시 가파른 오름세를 보이고 있기 때문이다.한때 리터(L)당 1800원대까지 치솟던 휘발유 가격은 유류세 인하 영향으로 L당 1600원대로 다소 안정세를 찾은 모습이지만 여전히 부담스러운 가격대다.더욱이 코로나19 이후 지난 2년간 꽁꽁 묶어놓은 공공요금이 내년 새 정부 출범 이후 한꺼번에 큰 폭으로 오를 가능성을 전혀 배제할 수 없는 상황이어서 서민들의 ‘고물가 부담’이 장기화될 전망이다.20일 한국농수산식품유통공사 농산물유통정보(KAMIS)·대전시에 따르면 이날 기준 쌀 1포대(20kg·상품 기준)가격은 5만8300원으로 평년(4만9433원)대비 8867원(17.93%)이나 올랐다. 쌀값은 지난해 햅쌀이 나온 이후 1년 내내 6만원 안팎의 강세가 이어지고 있다.이달 초 5000원대까지 내렸던 계란 한판(특란·30개)가격은 AI 확산으로 6685원으로 껑충 뛰었다. 한때 8000원대까지 올라 ‘금란’의 위세를 떨치던 상황이 재현되는 것 아니냐는 우려도 나오고 있다.서민 음식인 축·수산물 오름세도 심상치 않다.이날 기준 Δ닭고기(도계·1kg) 5000원[평년(4473원)대비 527원(11.78%)↑] Δ돼지고기(삼겹살·국산냉장·100g) 2520원[평년(1974원)대비 546원(27.65%)↑] Δ물오징어(생물·1마리) 5000원[평년(2500원)대비 2500원(100%)↑] 등 각각 오른 가격에 거래되고 있다.코로나19 장기화 영향으로 집밥 수요가 늘면서 돼지고기 가격이 예년에 비해 27%나 오르는 등 서민들의 밥상 물가 고공행진이 지속되고 있다. © News1닭고깃값 상승에 맞물려 교촌치킨 등 최근 주요 치킨 프랜차이즈들도 식용유, 튀김가루 등 원재료비 상승 등을 더해 소비자가격을 1000∼2000원 올려 ‘치킨 2만원 시대’를 열었다.라면, 참치캔, 즉석밥, 과자류, 빵류 등 마트에서 판매되고 있는 대부분의 가공식품은 올 한 해 동안 지속적인 상승세를 보여 서민들의 체감물가를 더욱 올리는 주요 요인으로 작용했다.이들 모두 국제 밀 가격 등 모두 수입 원자재가격이 급등하면서 소비자판매가 인상이 불가피하다는 게 주된 이유였다.칠성사이다 등 국내 음료업계가 이미 한차례 제품 가격을 올린 데 이어 코카콜라가 내년 1월1일부터 편의점에서 판매하는 코카콜라 6종 가격을 최대 200원 올린다.또, 동원F＆B는 GS25와 CU 등 주요 편의점에 공급하는 양반죽 12개 상품의 가격을 15%가량 인상키로 했다.특히, 코로나19 팬데믹과 유가 인상 등으로 국제물류 병목현상이 장기화되면서 수입 원재료를 기반으로 한 가공식품들의 가격 오름세는 당분간 지속될 전망이다.직장인 A씨(48·여) “예년에는 올랐다가도 곧 떨어지고 했던 것 같은데 이제 물가 이야기 꺼내기도 싫다”라며 “자녀에게 먹일 쇠고기는 호주산이나 미국산으로 등급을 내리고 치킨 주문은 횟수를 줄이는 등 졸라매는 방법 밖에 없다”며 한숨을 내쉬었다.한국석유공사가 운영하는 오피넷에 따르면 이날 기준 대전지역 휘발유 가격은 L당 1618원(전국 평균 1637원)을 기록했다.유류세 인하가 본격 적용된 지난달 12일 1762원(전국 1768원)에 비해 L당 144원이나 내렸지만 서민들에게 1620원대 휘발유 가격은 여전히 부담스럽기만 하다.더욱이 LPG 가격은 유류세 인하 시점인 지난달 12일 L당 1041원(전국 1048원)으로 반짝 하락한 후 이달 들어 오히려 꾸준히 올라 이날 기준 L당 1085원(전국 1088원)을 기록하는 등 ‘서민연료’라는 별칭을 무색게 하고 있다.여기에 Δ비빔밥 8700원 Δ삼계탕 1만3000원 등 외식서비스 요금도 껑충 뛰면서 방역패스와 식비부담을 줄이기 위해 도시락을 주문해 점심을 해결하는 직장인들이 점차 늘고 있다.이밖에 정부의 이번 전기요금 동결 결정에 따라 도시가스 등 나머지 공공요금도 대부분 동결될 것으로 보인다.하지만 코로나19 이후 지난 2년간 공공요금 인상을 억제해 온 대전시의 경우 Δ연간 1000억원에 가까운 시내버스 운영 적자 ΔLPG 가격 급등에 따른 택시업계의 기본요금 인상 요구 등 부담은 더욱 가중될 것으로 예상된다.더욱이 공급자 입장에서는 쌓여가는 적자를 언제가는 보전을 해야 하는 만큼 언젠가는 한꺼번에 감당하기 어려운 ‘폭탄 인상’ 우려도 제기되고 있다.이와 관련 과일가게를 운영하는 시민 B씨(53)는 “지난 18일부터 다시 거리두기 강화조치를 내리면서 1인당 100만원의 방역지원금 지급을 내건 것을 보면 선거가 얼마남지 않은 모양”이라며 “지금 동결한다고 그 부담이 줄어드는 것이 아니다. 언젠가는 챙겨간다. 결국 조삼모사(朝三暮四)로 국민들을 우롱하는 처사”라고 목소리를 높였다.		"
171,2021.12.05. 오전 9:39,3분기 밥상물가 5% 뛰었다…OECD 4위,"11월 장바구니 물가 6.1% 상승  “원자재·곡물 가격 상승 영향”         우리나라 밥상물가가 올해 3분기 지난해 같은 기간보다 5% 뛰었다. 경제협력개발기구(OECD) 회원국 중 네 번째로 높은 상승률을 기록했다.식료품과 비주류 음료를 포함하는 밥상물가는 지난 10월 농축수산물 가격이 안정되면서 1.6%로 떨어졌지만, 11월에는 농축수산물과 가공식품 가격이 오르면서 6.1%로 치솟았다.5일 통계청과 OECD에 따르면 3분기(7~9월) 한국보다 식료품과 비주류음료 물가 상승률이 높은 나라는 34개국 중 콜롬비아(11.2%), 호주(10.6%), 멕시코(8.0%)밖에 없었다. 칠레(5.0%)는 우리나라와 같았다.11월 소비자물가 상승률이 올해 들어 최고치인 3.7%까지 치솟았다. 사진은 2일 서울 한 대형마트에서 장 보는 시민의 모습.         한국의 3분기 소비자물가 상승률은 전년 동기 대비 2.6%를 기록했다. OECD 34개국 가운데 벨기에와 같은 공동 20위로, 상대적으로 낮은 편이이다. 다만 식료품과 비주류음료 물가만큼은 큰 폭으로 올라 상위권을 차지했다. 국제 원자재·곡물 가격 상승세와 국내 농축수산물 가격 상승세가 복합적으로 작용했기 때문으로 풀이된다.식료품과 비주류 음료 물가는 7개 분기 연속 오름세다. 올해 3분기 가격이 특히 많이 오른 품목은 달걀(51.6%), 배(45.2%), 사과(34.6%), 마늘(28.1%), 돼지고기(12.4%), 시금치(10.6%), 버섯(9.2%), 닭고기(7.9%), 국산 쇠고기(7.7%), 수입 쇠고기(7.3%), 햄·베이컨(7.0%), 빵(5.9%) 등이었다.밥상물가는 연말까지 상승세를 이어가는 모습이다. 11월 가공식품 물가는 3.5% 상승했고, 농축수산물은 7.6% 오르면서 식료품과 비주류 음료 물가도 6.1% 뛰었다. 식료품과 비주류 음료의 기여도가 0.89%포인트에 달하면서 11월 소비자물가 상승률은 9년 11개월만에 가장 높은 3.7%를 기록했다.석유류 가격 상승세가 이어지는 가운데 이른 추위로 농산물 작황이 부진하고 예년보다 김장이 빨리 이뤄졌던 것이 채소값 급등 요인으로 꼽힌다. 밥상에 오르는 식료품과 비주류 음료는 물가가 올라도 절약하는 데 한계가 있고, 자주 구매하기 때문에 소비자들이 물가 상승을 더 민감하게 느낀다.정부는 지난 3일 물가관계차관회의에서 “공급망 차질, 원자재 가격 변동성 확대, 오미크론 바이러스 등 물가 관련 불확실성이 여전하다”면서 “장바구니 물가의 안정적 관리를 위해 가용한 모든 수단과 정책 역량을 총동원하겠다”고 밝혔다."
172,2021.12.12. 오전 5:31,내년도 전기·가스요금 동결…연초부터 물가 기선제압,"한전·가스공사 적자 누적됐지만 물가안정 위해 고육책  지자체 공공요금도 동결 유도…부처별 물가책임제 가동내년도 전기·가스요금 동결…연초부터 물가 기선제압 [연합뉴스 TV 제공]    (세종=연합뉴스) 박용주 차지연 기자 = 정부가 내년에도 전기·도시가스 요금을 동결한다.     글로벌 공급망 차질과 국제 원자재 가격 및 수요 측 압력 상승 상황에서 연초에 쏟아질 물가 인상 움직임에 앞서 정부의 물가 대응 의지를 천명, 기선제압에 나서겠다는 것이다.  12일 기획재정부에 따르면 정부는 이달 20일께 내년도 경제정책방향을 발표하면서 전기와 도시가스 등 중앙 공공요금에 대한 동결 방침을 천명하는 방안을 검토하고 있다.    글로벌 원자재 가격 급등 국면에서 한국전력과 한국가스공사 등 공공기관의 적자가 누적돼 있지만 최소한 내년 상반기까지는 공공요금 인상 불가 방침을 연장하는 것이다. 공공요금 동결 (PG)[홍소영 제작] 일러스트    전기와 도시가스 등 공공요금은 다양한 상품·서비스의 원재료라는 점에서 공공요금 인상은 여타 물가 인상의 도화선 역할을 하는 경우가 많다. 또 시장 경제 체제에서 정부가 통제할 수 있는 몇 안 되는 가격인 만큼 정부의 물가 안정 의지를 확인하는 채널이 되기도 한다.     정부 관계자는 ""글로벌 공급망 차질과 국제 원자재 가격 상승 상황에서 수요 측면의 압력까지 커지고 있어 많은 기업이 연초를 기점으로 상품·서비스의 가격을 올릴 가능성이 상당하다고 보고 있다""면서 ""이런 상황에서 정부가 사실상 유일하게 통제 권한을 가진 공공요금 인상을 용인할 경우 물가 상승세가 걷잡을 수 없게 될 것""이라고 말했다.    정부는 지난해 10월 8년 만에 전기요금 인상을 용인했으나 추가 인상은 막았다. 내년 역시 당분간 추가 인상은 어렵다는 방침이다.     국제유가와 액화천연가스(LNG) 국제가격 상승세를 고려해 도시가스 요금을 인상해야 한다는 요구 역시 강했으나 연말까지 동결 방침을 고수한 데 이어 내년에도 이런 기조를 이어갈 계획이다. [그래픽] 소비자물가 추이[연합뉴스 자료그래픽]    지하철·시내버스·택시 등 대중교통 요금과 상하수도 요금, 종량제 봉투 요금 등 지방 공공요금도 인상을 최대한 억누르겠다는 방침이다.     지방 공공요금의 경우 지방자치단체 자율결정 사항이나 행정안전부가 쓸 수 있는 다양한 카드를 동원해 동결 기조를 이어가기로 했다. 물가 관리를 강화하는 방향으로 정부 내부 시스템도 바꾸고 있다.     정부는 내년 설 명절을 대비하는 물가 대응 시스템을 이번 주부터 가동한다.     기재부가 주축이 되는 관계부처 합동 특별대응팀을 만들고 분야별 물가 부처책임제도 도입했다. 부처별로 소관 분야 가격과 수급을 모니터링하고 대응 방안도 마련하는 시스템이다. 세계 인플레이션 (PG)[박은주 제작] 사진합성·일러스트    지자체 역시 행정안전부와 함께 물가대책 종합상황실을 운영한다.     쌀과 배추, 무, 사과, 소·돼지고기, 닭고기, 계란, 갈치, 고등어 등 17개 품목은 집중 관리하기로 했다.     계란은 내년에도 수입이 지속될 수 있도록 6개월간 월 1억개 물량에 대한 할당관세를 연장하기로 했다. 기본관세율이 0%가 된다는 의미다.     근본적인 유통구조를 바꾸는 작업도 이어간다. 이달 말에 계란 공판장 2곳을 가동해 계란 가격이 더 투명하게 형성될 수 있도록 하고 원유 가격 결정구조도 손보기로 했다.    도심부 알뜰주유소 간 이격거리 요건을 완화해 유류가격 인하 폭도 확대하기로 했다.  speed@yna.co.kr"
173,2021.12.17. 오전 9:58,"기재차관 ""설 물가 불안 요인 상당…성수품 공급 확대""","이억원 기재부 1차관이 17일 정부서울청사에서 물가관계차관회의를 주재하고 있다.(사진=기획재정부 제공)정부가 설 명절을 앞두고 물가 불안 요인이 상당하다고 보고 설 성수품 공급을 확대하기로 했다. 명절 기간 농축수산물 할인쿠폰 사용 한도도 1만원에서 2만원으로 상향 조정한다.정부는 17일 정부서울청사에서 이억원 기획재정부 제1차관 주재로 정책점검회의 겸 물가관계차관회의를 열고 이같이 밝혔다.이 차관은 “주요 채소류 가격이 점차 안정세를 보이고 있지만 소고기와 돼지고기 등 축산물 가격이 여전히 강세고 조류인플루엔자(AI)가 발생하는 등 설 명절을 앞두고 물가 불안 요인이 상존한다”고 설명했다.이에 따라 배추, 무, 소고기, 돼지고기, 닭고기, 계란, 고등어, 갈치, 쌀 등 17대 성수품을 설 명절 기간 주요 관리 품목으로 지정하고 가격 안정과 공급 확대 방안을 마련하기로 했다. 설 성수품은 공급 규모를 평시보다 확대하고 공급 시기는 예년 대비 1주일 앞선 설 3주 전으로 앞당긴다.농축수산물 할인쿠폰도 명절 기간 사용 한도를 기존 1만원에서 2만원으로 상향 조정하기로 했다. 설맞이 특별 할인행사도 연다. 설 기간 도축장 야간·주말 작업을 통해 소·돼지고기 물량 공급을 늘리고 12월부터 계란 수입을 재개하는 방안도 시행한다."
175,2021.12.10. 오전 9:28,"이억원 기재차관 ""내년 6월까지 계란 1억개 무관세 수입""","""물가 낮추겠다""사진=연합뉴스정부가 8~30%인 계란의 관세를 0%로 낮추는 조치를 6개월 연장한다. 내년 6월까지 매달 1억개의 계란을 기본관세율 0%로 수입할 수 있게 된다. 이억원 기획재정부 1차관은 10일 정부서울청사에서 제40차 혁신성장 전략점검회의 겸 정책점검회의 겸 한국판뉴딜 점검회의 겸 제35차 물가관계차관회의를 열고 이같은 방안을 확정했다.이 차관은 ""최근 조류인플루엔자(AI) 발생으로 불안심리가 확대된 계란은 가격 불안에 선제적으로 대응하기 위해 12월 중 수입란을 3000만개 도입하고, 내년에도 계란·계란가공품에 대한 수입이 지속될 수 있도록 6개월 간 월 1억개 물량에 대해 할당관세를 연장적용해 8~30%의 기본 관세율을 0%로 크게 낮추겠다""고 말했다.이는 11월 소비자 물가가 3.7% 상승하는 등 물가 불안이 심해지는 상황에서 나온 일부 유통업체들의 계란값 인상 움직임을 차단하기 위한 것으로 풀이된다. 밥상 물가가 더 오르면 국민들의 피해가 커질 것이란 점을 감안한 조치다.이 차관은 이와함께 석유류와 설 명절 품목 물가 관리도 하겠다고 했다. 이 차관은 ""오미크론 확산 영향으로 국제유가가 최고점 대비 하락했다""며 ""유가 하락과 유류세 인하 효과가 석유류 가격에 신속히 반영될 수 있도록 현장점검을 지속하겠다""고 말했다. 그러면서 ""불공정 행위가 적발될 경우 공정위 등 관계기관에 통보하고 엄정 조치할 방침""이라고 덧붙였다.설 물가대응체계는 다음주부터 가동된다. 이 차관은 ""예년 설보다 3주 빠르게 물가대응을 하겠다""며 ""배추, 무, 사과, 배, 밤, 대추, 소·돼지고기, 닭고기, 계란, 명태, 물오징어, 갈치, 고등어, 조기, 마른멸치 등 16대 성수품과 쌀 물가를 중점 관리품목으로 지정했다""고 밝혔다. 이에 앞서 올해 생산량 감소로 가격 강세를 보인 마늘은 1만톤을 수입해 가격을 안정시킨다는 계획이다.이날 회의에서는 상생소비지원금 현황도 점검했다. 이 차관은 ""지난 10월 1일 개시된 상생소비지원금 사업은 두 달에 걸쳐 총 1566만명이 참여해 약 8000억원의 캐시백이 발생했다""고 설명했다. 그러면서 ""상생소비지원금은 신용카드 인프라와 ICT기술이 있었기 때문에 가능했다""며 ""추후 KDI 등을 통해 사업의 성과를 엄밀히 분석해보겠다""고 덧붙였다.지난해 진행된 100조원 투자 프로젝트는 올해 110조원 프로젝트로 확대 실시하고, 30일 시행 예정인 일반지주회사의 기업형벤처캐피탈(CVC) 제한적 보유를 뒷받침하기 위한 시행령을 조속히 완비하겠다고도 했다."
177,2021.12.25. 오전 6:02,생산자 물가 13년 만에 최대폭 상승,"-높아지는 인플레이션 압력[숫자로 본 경제]국내 생산자 물가 13년 만에 상승폭 최대치 국제 유가와 원자재 가격 상승이 지속되면서 국내 생산자물가지수가 13년 만에 최대 폭으로 상승했다.한국은행이 2021년 12월 21일 발표한 ‘2021년 11월 생산자물가지수’에 따르면 11월 생산자물가지수는 112.99(2015년 100)로 전월 대비 0.5% 상승했다. 13개월 연속 상승한 것으로 8개월째 관련 통계 작성 이후 최고 지수다. 전년 동월 대비로는 무려 9.6% 상승하면서 12개월 연속 올랐다. 이 같은 상승폭은 2008년 10월(10.8%) 이후 13년 1개월 만의 최대치다.생산자 물가의 상승은 원자재 가격 상승세의 영향으로 공산품이 오른 데 따른 것으로 풀이된다. 실제 공산품은 전달보다 1.5% 상승했다. 석탄과 석유 제품이 3.8% 상승하고 화학 제품은 0.7% 올랐다. 액화천연가스(LNG) 가격 상승으로 도시가스 요금이 7.9% 올라 전력·가스·수도·폐기물도 전월 대비 1.8% 상승했다. 또 농림수산품은 농산물(1.6%)과 축산물(0.8%) 등이 올라 전월 대비 1.5% 상승했다. 서비스도 운송 서비스(0.7%) 등이 올라 전월 대비 0.2% 상승했다.최진만 한국은행 경제통계국 물가통계팀 팀장은 “국제 유가나 원자재 가격 상승 영향이 지속되면서 석유·석탄 제품, 화학 제품, 1차 금속 제품을 중심으로 생산자물가지수가 상승했다”며 “12월 국제 유가나 원자재 가격이 11월 대비 다소 하락세를 보여 생산자물가지수도 전월 대비로는 상승세가 다소 둔화됐지만 전년 대비로는 아직 기저 효과가 작용해 11월보다 상승했다”고 말했다.세부 품목별로 보면 전년 동월 대비 생산자물가지수는 오이(125%), 마늘(47.9%), 돼지고기(24.8%), 닭고기(28.3%) 등 농축산물이 오른 것을 비롯해 경유(101.3%), 나프타(108.5%), 벤젠(108.8%), 노트북용LCD(58.8%) 등 공산품도 올랐다. 소비자의 사용 빈도가 높은 물품을 포함해 상승세가 나타나고 있다.생산자 물가는 시차를 두고 소비자 물가에 전가되는 만큼 소비자 물가 역시 2022년 초까지 상승할 가능성이 높다. 한국은행은 2021년 12월 16일 2021년 소비자 물가 상승률이 한국은행의 물가 안정 목표인 2%를 넘어설 것이라고 전망했다. 2021년 1월부터 11월까지 물가 상승률이 2.3%로 2020년(0.5%)에 비해 오름폭이 크게 확대됐다. 이 같은 물가 상승세는 미국과 중국 등을 포함한 글로벌 현상이라는 점에서 인플레이션 공포가 더욱 확대될 것으로 보인다."
178,2021.12.25. 오후 1:03,"LF푸드 모노키친, 닭다리살로 만들어 육즙이 팡팡 터진다 … ‘통! 닭다리살 꼬치’","집에서는 에어프라이어로 간편하게, 캠핑장에선 직화구이 15분이면 ‘겉바속촉’ 꼬치 완성종합식품기업 LF푸드(대표 이승우)의 HMR 브랜드 모노키친이 ‘통! 닭다리살 꼬치’를 출시했다. 신제품 ‘통! 닭다리살 꼬치(370g)’는 큼직하게 자른 통 닭다리살을 사용해 쫄깃한 식감과 풍부한 육즙이 돋보이는 제품이다.닭고기의 잡내를 없애고 육질을 더욱 부드럽게 하는 텀블링 방식으로 염지한 뒤 소금, 후추로 간을 더해 그대로 먹으면 담백하고, 동봉된 숯불바베큐소스를 곁들이면 매콤한 감칠맛까지 즐길 수 있다.냉동 상태의 닭꼬치를 에어프라이어 200℃로 18분간 조리하거나 해동된 제품을 그릴 위해 올려 15분간 앞뒤로 구우면 겉은 바삭하고 속은 촉촉한 ‘겉바속촉’ 꼬치가 완성된다. 개인용 화로에 올려 선술집 분위기를 낼 수 있고, 간편한 캠핑 음식으로도 제격이다.아이 간식부터 어른들의 술안주까지 활용도 높은 모노키친의 ‘통! 닭다리살 꼬치’의 가격은 7900원이며, 마켓컬리에서 가장 먼저 만나볼 수 있다.김병주 LF푸드 상품개발팀장은 “남녀노소 좋아하는 닭꼬치를 쫄깃한 닭다리살로 만들어 더욱 건강하고 푸짐하게 즐길 수 있도록 준비했다”며, “미니 화로나 캠핑장에서 숯불에 구우면 불 맛까지 더할 수 있다”고 말했다.HMR 브랜드 모노키친이 ‘통! 닭다리살 꼬치’를 출시했다. (LF푸드 제공)"
